Phase,Component,Priority,Estimated Effort,Key Tasks
Phase 1: Foundation,Architecture Design,Critical,1-2 weeks,"Define layers, interfaces, data models"
Phase 1: Foundation,Dependency Injection,Critical,1 week,"Setup DI framework (Hilt/Koin), define modules"
Phase 1: Foundation,Platform Abstraction,High,1-2 weeks,"Create Android/iOS adapters, common interface"
Phase 2: Core Services,State Machine,Critical,2 weeks,"FSM for connection lifecycle, transitions, events"
Phase 2: Core Services,Connection Manager,Critical,2-3 weeks,"Connection pool, queue, reconnection logic"
Phase 2: Core Services,Security Manager,High,2 weeks,"Encryption, key exchange, OOB pairing"
Phase 2: Core Services,Provisioning Orchestrator,Critical,2 weeks,"Coordinate provisioning flow, validation"
Phase 3: Protocol Layer,GATT Handler,Critical,2 weeks,"Service discovery, characteristic ops, MTU negotiation"
Phase 3: Protocol Layer,Data Serialization,High,1 week,"Efficient data packing/unpacking, compression"
Phase 3: Protocol Layer,Error Handler,High,1-2 weeks,"Retry policies, timeout management, error codes"
Phase 4: Quality & Scale,Testing Framework,Critical,2 weeks,"Unit tests, integration tests, mock BLE devices"
Phase 4: Quality & Scale,Logging & Metrics,High,1 week,"Structured logging, telemetry, analytics"
Phase 4: Quality & Scale,Performance Optimization,Medium,1-2 weeks,"Connection speed, power consumption, memory"
Phase 4: Quality & Scale,Documentation,High,1 week,"API docs, examples, architecture guide"
Phase 5: Advanced Features,Multi-device Support,Medium,2 weeks,Handle multiple simultaneous connections
Phase 5: Advanced Features,Background Operations,Medium,1-2 weeks,"Foreground services, work manager integration"
Phase 5: Advanced Features,Mesh Support,Low,3-4 weeks,"BLE Mesh provisioning, relay nodes"
Phase 5: Advanced Features,Cloud Integration,Low,2 weeks,"Remote provisioning, device management"
